{
  "status": "validated",
  "submission_status": "validated_not_stored",
  "task_id": "agent_discovery_001",
  "stored": false,
  "acceptance_status": "not_reviewed",
  "completion_status": "not_verified",
  "validation": {
    "status": "passed",
    "required_fields_present": true,
    "invalid_fields": [],
    "task_id_exists": true,
    "schema_version": "0.4-contract-preview",
    "scope": "payload_structure_and_task_membership"
  }
}
